Place ID,Name,Address,Rating,Types
ChIJzxsNOyZYei4Reawc_uk_nRU,Bina Nusa Rama PT,"Mal Malioboro Ground Floor, Jl Malioboro No 52-58, Suryatmajan, Kota Yogyakarta",3.5,"['restaurant', 'point_of_interest', 'food', 'establishment']"
ChIJ3-Fji7lXei4REtfqid2XtZs,Fast Food Restaurant,"Krapyak Kulon, Panggungharjo, Bantul Regency",0,"['restaurant', 'point_of_interest', 'food', 'establishment']"
ChIJlaCckJVZei4R13XDnq3-8dw,Coconut Club Restaurant,"Jl. Jend. Sudirman No.89, Terban, Kota Yogyakarta",5,"['restaurant', 'point_of_interest', 'food', 'establishment']"
ChIJB5MnxL1Zei4RU9zXURy8v0g,Fast Food Restaurant,"Dabag, Condongcatur, Sleman Regency",3,"['restaurant', 'point_of_interest', 'food', 'establishment']"
ChIJB_L6rrBZei4Rr3ixrqJY0Ug,Dunia Kita Cafe & Restaurant,"Jl. Seturan Raya No.168 A, Kledokan, Caturtunggal, Kabupaten Sleman",4.6,"['restaurant', 'point_of_interest', 'food', 'establishment']"
ChIJEZ-zNvpZei4RUKY86z5OmCI,Purple Restaurant,"Jl. Laksda Adisucipto No.80, Demangan Baru, Caturtunggal, Kabupaten Sleman",2.7,"['restaurant', 'point_of_interest', 'food', 'establishment']"
ChIJy7kW9t5Zei4RM9TQDCBECLU,Resto,"Jl. Palagan Tentara Pelajar No.43-49, Jongkang, Sariharjo, Kabupaten Sleman",0,"['restaurant', 'point_of_interest', 'food', 'establishment']"
ChIJTXnINj9Yei4R67U853oBhuA,Fast Food Restaurant,"Kricak, Yogyakarta City",3,"['restaurant', 'point_of_interest', 'food', 'establishment']"
ChIJX900A11Yei4RVyNQ82OYoa4,Fast Food Restaurant,"69P4+FXR, Jl. Bangau, Kutu Patran, Sinduadi, Kabupaten Sleman",3,"['restaurant', 'point_of_interest', 'food', 'establishment']"
ChIJH03CYY1Xei4RTDTe65njvUk,Bale Raos - The Sultan's Dishes,"Jl. Magangan Kulon No.1, Panembahan, Kota Yogyakarta",4.5,"['restaurant', 'point_of_interest', 'food', 'establishment']"
ChIJAdR69vFYei4RhdlM_YlABM0,Joglo Mlati Restaurant,"Jl. Kebon Agung No.170, Karang Geneng, Sendangadi, Kabupaten Sleman",4.3,"['restaurant', 'point_of_interest', 'food', 'establishment']"
ChIJ5ZKIDtpZei4RcMs45LYRr14,Fast Food Restaurant,"Demangan, Yogyakarta City",0,"['restaurant', 'point_of_interest', 'food', 'establishment']"
ChIJ-2XrOcVZei4RGmVtZv7QbP0,Ibis Kitchen Restaurant,"Jl. Laksda Adisucipto No.80, Demangan Baru, Caturtunggal, Kabupaten Sleman",4.5,"['restaurant', 'point_of_interest', 'food', 'establishment']"
ChIJRRu6OMJZei4Rd7wU9hQgj7Y,Fast Food Restaurant,"Tempel, Caturtunggal, Sleman Regency",2,"['restaurant', 'point_of_interest', 'food', 'establishment']"
ChIJ41Y7mRdYei4RGhBz7yUqP6o,Fast Food Restaurant,"Tegalrejo, Yogyakarta City",3.5,"['restaurant', 'point_of_interest', 'food', 'establishment']"
ChIJo3eXS1JYei4RtW5mo0PVT88,Bubur Ayam Dan Soto Ayam Fast Food Restaurant,"Pogung Kidul, Sinduadi, Sleman Regency",0,"['restaurant', 'point_of_interest', 'food', 'establishment']"
ChIJJ0ZYc7FZei4RjfQ-zKdc4LY,Pamungkas Warmindo Restaurant,"Jalan Agro, Klebengan, Karang Gayam, Caturtunggal, Kabupaten Sleman",4.7,"['restaurant', 'point_of_interest', 'food', 'establishment']"
ChIJGVWHzApYei4RTD1XiRZwLX8,Fast Food Restaurant,"Nogosaren, Nogotirto, Sleman Regency",0,"['restaurant', 'point_of_interest', 'food', 'establishment']"
ChIJjTG0rYtYei4RDojTDe5ovKs,Pecel Lele Restaurant,"Trini, Trihanggo, Sleman Regency",0,"['restaurant', 'point_of_interest', 'food', 'establishment']"
ChIJDStsz4VYei4RyDb_sHAX-D4,Warung Makan Mie Ayam & Bakso Fastfood Restaurant,"68XR+W5W, Jl. Ring Road Utara, Baturan, Trihanggo, Kabupaten Sleman",4,"['restaurant', 'point_of_interest', 'food', 'establishment']"
ChIJn4gALk1Yei4RwB-wq61W_1s,Tora Tora Restaurant (Japanese Cuisine),"69MH+JRC, Senolowo, Sinduadi, Sleman Regency",4.3,"['restaurant', 'point_of_interest', 'food', 'establishment']"
ChIJLUYfT85Zei4RrPNf-Drgay4,De Laxston Restaurant,"De Laxston hotel Area, Jl. Urip Sumoharjo No.139 A, Klitren, Kota Yogyakarta",4.2,"['restaurant', 'point_of_interest', 'food', 'establishment']"
ChIJC8MifitYei4RwZSHcQxN8Sg,“Malinda” Restaurant,"Jl. Lempuyangan No.001, Bausasran, Kota Yogyakarta",3.2,"['restaurant', 'point_of_interest', 'food', 'establishment']"
ChIJA0v0I-FZei4RfwVDpT27OVM,Hauw Family Restaurant,"Jl. Nogotirto No.34, Area Sawah, Nogotirto, Kabupaten Sleman",4.7,"['restaurant', 'point_of_interest', 'food', 'establishment']"
ChIJD2Q_Mu9Zei4Rl0cJ04xiGS4,Verandah Alfresco,"Eastparc Hotel Area, Jalan Laksda Adisucipto Km. 6.5, Seturan, Caturtunggal, Kecamatan Depok, Ngentak, Caturtunggal, Kabupaten Sleman",4.5,"['restaurant', 'point_of_interest', 'food', 'establishment']"
ChIJwcsJHPZXei4R4kF5_cBWais,The Tannoor Restaurant,"Jl. Sartono No.827, Mantrijeron, Kota Yogyakarta",4.8,"['restaurant', 'point_of_interest', 'food', 'establishment']"
ChIJLzJulxpXei4RhH3JNtgorQE,Sekar Kedhaton Restaurant,"Jl. Tegal Gendu No.28, Prenggan, Kota Yogyakarta",4.5,"['restaurant', 'point_of_interest', 'food', 'establishment']"
ChIJPeVunsJZei4RQhjcjX9gNXs,Yashinoki Restaurant Karaoke Pub,"Jl. Laksda Adisucipto Km. 6 Catur Tunggal Depok Sleman Daerah Istimewa Yogyakarta, Ambarukmo, Caturtunggal, Kabupaten Sleman",3,"['restaurant', 'point_of_interest', 'food', 'establishment']"
ChIJ_zHPwqRZei4RihcRtLxZLRk,Gadjah Wong Restaurant,"Jl. Affandi No.79D, Soropadan, Condongcatur, Kabupaten Sleman",4.5,"['restaurant', 'point_of_interest', 'food', 'establishment']"
ChIJcQKhsGNYei4RwCFbc514IOY,Fast Food Restaurant,"Salakan, Trihanggo, Sleman Regency",4.3,"['restaurant', 'point_of_interest', 'food', 'establishment']"
ChIJcWPbYTBYei4R5__kiNVcX6Y,Madam Tan Indonesian Food,"Jl. C. Simanjuntak No.78A, Terban, Kota Yogyakarta",4.3,"['restaurant', 'point_of_interest', 'food', 'establishment']"
ChIJQS8_ytJZei4RK9-6ZrnGGOI,Baru Restaurant,"696H+XFJ, Jl. Kusbini, Demangan, Kota Yogyakarta",4.5,"['restaurant', 'point_of_interest', 'food', 'establishment']"
ChIJkVIOs4VXei4RnrM5Venr8Fs,Lie Djiong Restaurant,"Jl. Brigjen Katamso No.21, Prawirodirjan, Kota Yogyakarta",4.5,"['restaurant', 'point_of_interest', 'food', 'establishment']"
ChIJjUjwGjBYei4RxIHWOsZFMrs,Twin's Mart & Restaurant,"6979+W2F, Jl. Kp. Jogoyudan, Gowongan, Kota Yogyakarta",0,"['restaurant', 'point_of_interest', 'food', 'establishment']"
ChIJRXwEKYhXei4Rn3SxsVMvRj0,Mahkota Chinese Restaurant,"Jl. Pajeksan No.25, Ngupasan, Kota Yogyakarta",4.5,"['restaurant', 'point_of_interest', 'food', 'establishment']"
ChIJOUWD0rxXei4Rk2MxMRpvLQg,KESUMA Restaurant,"Jl. Sartono No.829, Mantrijeron, Kota Yogyakarta",4.6,"['restaurant', 'point_of_interest', 'food', 'establishment']"
ChIJhdCiKSZYei4RL7zxCFh65rQ,La Table Restaurant,"Jl. Malioboro No.52-58, Suryatmajan, Kota Yogyakarta",5,"['restaurant', 'point_of_interest', 'food', 'establishment']"
ChIJHUyvBJ9Zei4RPpdMs9oy97o,atiga cafe,"Jl. Delima, leles, Condongcatur, Kabupaten Sleman",4.6,"['cafe', 'food', 'point_of_interest', 'establishment']"
ChIJ83FQBmJZei4RGDXOV6dJcTs,Cafe Es.kopi djawa,"Jalan, Kutu Patran, Sinduadi, Sleman Regency",4.7,"['cafe', 'food', 'store', 'point_of_interest', 'establishment']"
ChIJkTTtzepZei4R_qvPU4ETG0c,MbahMoe Cafe,"Jl. Perumnas, Dabag, Condongcatur, Kabupaten Sleman",4.3,"['cafe', 'food', 'store', 'point_of_interest', 'establishment']"
ChIJI67jIMtZei4RyGXIaVtfAN4,Petik Merah Cafe & Roastery,"Jl. Cucak Rowo No.1, Demangan Baru, Caturtunggal, Kabupaten Sleman",4.5,"['cafe', 'food', 'store', 'point_of_interest', 'establishment']"
ChIJWz5bDKJZei4RiLAKO7IPHb0,Cahyo cafe,"Jl. Tampar No.34, Karangwuni, Caturtunggal, Kabupaten Sleman",4.9,"['cafe', 'food', 'point_of_interest', 'establishment']"
ChIJXTMpu1BXei4Rx1KYOKlEU24,R3 CAFE,"Brajan, Tamantirto, Bantul Regency",4.3,"['cafe', 'food', 'store', 'point_of_interest', 'establishment']"
ChIJgbfOZjRYei4RgtVB5W3lH2g,Coklat Cafe,"Jl. Cik Di Tiro No.19, Terban, Kota Yogyakarta",4.5,"['cafe', 'food', 'point_of_interest', 'establishment']"
ChIJN_0v3ftZei4RR_TEC1LS-a8,TROTOAR CAFE,"Jl. Asem Kranji No.73, Dero, Condongcatur, Kabupaten Sleman",5,"['cafe', 'food', 'point_of_interest', 'establishment']"
ChIJ--6KH6NXei4RsxqyqmnEyiI,Luku Cafe,"59J9+87J, Jl. Parangtritis, Mantrijeron, Kota Yogyakarta",4.5,"['cafe', 'food', 'point_of_interest', 'establishment']"
ChIJ58SWYKZZei4RteU_zHB_Yb8,Cafe Koempul,"69VV+27F, Candok, Condongcatur, Sleman Regency",4.5,"['cafe', 'food', 'point_of_interest', 'establishment']"
ChIJ12iZq5ZXei4RgQuh1QR2C3c,RT Cafe,"Jl. Patehan Lor No.8, Patehan, Kota Yogyakarta",4.6,"['cafe', 'food', 'point_of_interest', 'establishment']"
ChIJl1DJyt5Zei4Rvz_yPQeMcf8,Warmindo Perdana Cafe,"Jl Gandekan lor no 62, Pringgokusuman, Kota Yogyakarta",4.4,"['cafe', 'food', 'point_of_interest', 'establishment']"
ChIJuRhXwgX4ei4R7-Z1IDKQKjU,Bejo Coffee Cafe,"Jl. Anggrek Tegalrejo, Geblagan, Tamantirto, Kabupaten Bantul",4.5,"['cafe', 'food', 'point_of_interest', 'establishment']"
ChIJg73Jd9hZei4R5o3ahoBpAxw,Super Hotspot Cafe Timoho,"694V+446, Jl. Timoho, Muja Muju, Kota Yogyakarta",4.6,"['cafe', 'food', 'point_of_interest', 'establishment']"
ChIJMSH7IKNXei4RZwrjtxaPICs,Rui's Cafe,"59J8+469, Jl. Parangtritis, Mantrijeron, Kota Yogyakarta",4.4,"['cafe', 'food', 'point_of_interest', 'establishment']"
ChIJ--AUZHVXei4RRjha7h4e_SM,Mangguk Coffee Cafe,"6C22+HJ4, Gg. Tirta, Jomblangan, Banguntapan, Kabupaten Bantul",4.7,"['cafe', 'food', 'point_of_interest', 'establishment']"
ChIJZ_CIZHxZei4RSCdqRK4WZpc,SlAMET CAFE,"Jl. Prau No.31, Kotabaru, Kota Yogyakarta",4.9,"['cafe', 'food', 'point_of_interest', 'establishment']"
ChIJzeTyeWtXei4RtdDcog7TliQ,RanyBelle Cafe,"32 street, Jl. Prawirotaman No.1, Kota Yogyakarta",4.9,"['cafe', 'food', 'point_of_interest', 'establishment']"
ChIJRQ0FhCtXei4Rast2IxCBRVE,missLOKA - Café and Eatery,"58XR+2J3, Jl. IKIP PGRI I Sonosewu, Sonosewu, Ngestiharjo, Kabupaten Bantul",4.9,"['cafe', 'food', 'store', 'point_of_interest', 'establishment']"
ChIJ-QfuuAZXei4RsyQDeFNowp0,OKID Cafe,"Jl. Panembahan No.1-3, Panembahan, Kota Yogyakarta",4.7,"['cafe', 'food', 'store', 'point_of_interest', 'establishment']"
ChIJuwnxWIlXei4RVDayOeTHcF4,CAFE SUKA SUKA,"Jl. Tegal Kenongo No.rt 02, Tegal Kenanga, Tirtonirmolo, Kabupaten Bantul",5,"['cafe', 'store', 'food', 'point_of_interest', 'establishment']"
ChIJLcK1tI1Zei4RPiiyIW38jNM,Point Coffee,"Jl. Timoho No.90, Baciro, Kota Yogyakarta",4.7,"['cafe', 'store', 'food', 'point_of_interest', 'establishment']"
ChIJ85zpM3RZei4R8uhLDcG5B3U,Metreum Cafe,"695X+M84, Jomblangan, Banguntapan, Bantul Regency",4.4,"['cafe', 'store', 'food', 'point_of_interest', 'establishment']"
ChIJ6TBsvDxZei4RMj4LyLsr1BI,Chaiya Cafe,"Taman Kuliner Condong Catur, Kios R-28, Jl. Anggajaya III Jl. Affandi, Gejayan, Condongcatur, Kabupaten Sleman",5,"['cafe', 'food', 'point_of_interest', 'establishment']"
ChIJT802CndXei4RnbV0q9GPMfc,Sawo 7 Cafe and Guest House,"Jl. Sawojajar No.7, Panembahan, Kota Yogyakarta",4.5,"['cafe', 'lodging', 'food', 'point_of_interest', 'establishment']"
ChIJ-1Thfn1Xei4RdP5_TuNLnLU,good day cafe,"5,, Jl. Cantel Baru No.3, Semaki, Kota Yogyakarta",4.6,"['cafe', 'food', 'point_of_interest', 'establishment']"
ChIJn22PYLVZei4Re-vyd5zTsl8,Semusim Cafe,"69WM+PMM Daerah Istimewa, Purwosari, Sinduadi, Sleman Regency",4.4,"['cafe', 'store', 'food', 'point_of_interest', 'establishment']"
ChIJc86PnqJZei4RsmnQA2NhTCc,Uptown Cafe and Space,"6CG5+G45, Jl. Student Castle, Kledokan, Caturtunggal, Kabupaten Sleman",4.7,"['cafe', 'store', 'food', 'point_of_interest', 'establishment']"
ChIJB4c4wt9Zei4Rj0ip9kvlzyY,Maji Cafe and Eatery,"Jl. Sorowajan Baru, Jomblangan, Banguntapan, Kabupaten Bantul",4.5,"['cafe', 'store', 'food', 'point_of_interest', 'establishment']"
ChIJA634c-pZei4RrdNdN0kRTCM,Lipu Cafe(ꦭꦶꦥꦸꦕꦥ꦳ꦼ),"6CF3+Q7P, Jl. Melon Mundusaren, Nologaten, Caturtunggal, Kabupaten Sleman",4.6,"['cafe', 'food', 'point_of_interest', 'establishment']"
ChIJszORIKNXei4RjDQbK97emDk,Made Cafe And Restaurant,"no.64 B, Jl. Parangtritis, Mantrijeron, Yogyakarta City",4.5,"['cafe', 'food', 'point_of_interest', 'establishment']"
ChIJ-WeC6kNZei4R8HgV8lgkXkw,CAFE KOPI JONO,"Jl. Jlagran No.7C, Pringgokusuman, Kota Yogyakarta",4.3,"['cafe', 'store', 'food', 'point_of_interest', 'establishment']"
ChIJ_0-QsNVZei4RxO1W8-cB8sw,Cafe Pojok Johar 108,"Gg. Johar No.259, Ngentak, Caturtunggal, Kabupaten Sleman",5,"['cafe', 'store', 'food', 'point_of_interest', 'establishment']"
ChIJxaJ_9b9Zei4RPGgm68bD0FM,Nevada Cafe,"6CG2+377, Jalan Nologaten Depok, Nologaten, Caturtunggal, Kabupaten Sleman",4.2,"['cafe', 'food', 'point_of_interest', 'establishment']"
ChIJ3RBKdxFXei4R3zHkxxts9BE,Retroest Cafe,"RedDoorz @, Jl. Jogja Ring Road Sel., Menayu Kidul, Tirtonirmolo, Kasihan, Jl. Jogja Ring Road Sel. No.2, Kabupaten Bantul",5,"['cafe', 'food', 'point_of_interest', 'establishment']"
ChIJ0ZWBLQBXei4Rx1v20I1L8vE,Oase Cafe & Resto - Tamansiswa,"Jl. Taman Siswa No.31, Wirogunan, Kota Yogyakarta",4.5,"['cafe', 'store', 'food', 'point_of_interest', 'establishment']"
ChIJnUjfkOpZei4RgfjtkEbTuvs,Jammin Cafe,"6CF3+V8V, Jl. Melon Mundusaren, Nologaten, Caturtunggal, Kabupaten Sleman",4.6,"['cafe', 'food', 'point_of_interest', 'establishment']"
ChIJe1EzYnb4ei4RoErC9evsXs8,Cafe Raos' 03,"58GH+56W, Jetis, Tamantirto, Bantul Regency",5,"['cafe', 'food', 'point_of_interest', 'establishment']"
ChIJccdFmt5Zei4RJEBNJojtw5E,Basabasi Sorowajan Cafe,"Jl. Sorowajan Baru, Jomblangan, Banguntapan, Kabupaten Bantul",4.4,"['cafe', 'food', 'point_of_interest', 'establishment']"
ChIJMxSlUVBYei4RtwlJDOsCnnU,Vito Cafe Monjali,"Monjali St No.248, Gemawang, Sinduadi, Sleman Regency",3.6,"['cafe', 'store', 'food', 'point_of_interest', 'establishment']"
ChIJfzwT1uxXei4RQ5j8UOsm4cA,UHT (Ultra High Temptation) Cafe,"Jl. Ipda Tut Harsono No.35, Muja Muju, Kota Yogyakarta",4.3,"['cafe', 'food', 'point_of_interest', 'establishment']"
ChIJCRVNjJhZei4Roue2rpgMfyg,Babylon Cafe&Resto,"Jl. Gejayan Soropadan XII No.79B, Soropadan, Condongcatur, Kabupaten Sleman",4.4,"['cafe', 'restaurant', 'food', 'point_of_interest', 'establishment']"
ChIJkydzIaNXei4RrQAwnx58EyY,Banana Cafe,"59J9+75H, Jl. Parangtritis, Mantrijeron, Kota Yogyakarta",4.2,"['cafe', 'food', 'point_of_interest', 'establishment']"
ChIJ5zoRUyRZei4RV91NA020L8k,Estuary Café,"Gang Code 3, Karangjati Wetan, No.170 C, Monjali St, RT.06/RW.45, Gemawang, Sinduadi, Sleman Regency",4.6,"['cafe', 'store', 'food', 'point_of_interest', 'establishment']"
ChIJSaPQEhhZei4RblzCuh1TLcc,Atap Langit Container Cafe,"Cambahan, Nogotirto, Sleman Regency",4.6,"['cafe', 'food', 'point_of_interest', 'establishment']"
ChIJhTdpyMVZei4RiOW2bxGtcKA,Perigon Cafe,"Perigon Fitness Studio, Jl. Demangan Baru No.6F, Demangan Baru, Caturtunggal, Sleman Regency",5,"['cafe', 'food', 'point_of_interest', 'establishment']"
ChIJjf3V6rxXei4R0lNHoFphUss,POENOKAWAN CAFE RESTO & GALLERY,"Jl. KH. Ahmad Dahlan No.71, RW.08, Notoprajan, Kota Yogyakarta",4.6,"['cafe', 'store', 'food', 'point_of_interest', 'establishment']"
ChIJM3SSsFhYei4RNhBQ9ANcxfM,Tam's Cafe,"Jalan Magelang Km. 5,6, Kutu Tegal, Sinduadi, Mlati, Kutu Tegal, Sinduadi, Kabupaten Sleman",4.8,"['cafe', 'food', 'point_of_interest', 'establishment']"
ChIJycbLQANZei4Rleizz1lxEy0,CAFE RAJA VITAMIN 8,"Jl. Gading Sari No.38-1, Area Sawah, Banyuraden, Kabupaten Sleman",4,"['cafe', 'store', 'food', 'point_of_interest', 'establishment']"
ChIJyTnLGv1Xei4RI0o-fBuc7cA,Marginal Cafe Warmindo UAD 4,"59CH+WQ2, Jl. Ki Ageng Pemanahan, Sorosutan, Kota Yogyakarta",5,"['cafe', 'store', 'food', 'point_of_interest', 'establishment']"
ChIJlft8vspZei4ROTYNQx0PPmI,Litterless Juicy Cafe,"Jl. Cucak Rowo Jl. Demangan Baru No.5a, Demangan Baru, Caturtunggal, Kota Yogyakarta",4.9,"['cafe', 'food', 'point_of_interest', 'establishment']"
ChIJL844E6lZei4R3TTNfEFnjGQ,Bengkel-Cafe,"Manggung, Caturtunggal, Sleman Regency",2.8,"['cafe', 'food', 'point_of_interest', 'establishment']"
ChIJERrqcmJZei4RTH0JhGsHJEY,Dongan Tea & Goods (Cafe),"Jl. Demangan Baru, Mrican, Caturtunggal, Kabupaten Sleman",4.9,"['cafe', 'food', 'point_of_interest', 'establishment']"
ChIJNZPI905Zei4RsHUNZupIZ6Y,Pulpa Cafe,"toko tugu bakpia kukus tugu, Jl. P. Mangkubumi No.43 Lantai 2, tugu Yogyakarta, Yogyakarta City",4.9,"['cafe', 'store', 'food', 'point_of_interest', 'establishment']"
ChIJNTSchsFZei4RO-KZRYiv3JU,Bento Cafe Nologaten,"Jl. Nologaten, RT.04/RW.01, Tempel, Caturtunggal, Kabupaten Sleman",4.3,"['cafe', 'store', 'food', 'point_of_interest', 'establishment']"
ChIJSaUr-Zn5ei4RnbjIdLP3zzg,Dikwaa Cafe & Jogja Cheese Cake,"58MF+JJW, Jl. Ring Road Selatan, Gatak, Tamantirto, Kabupaten Bantul",4.4,"['cafe', 'food', 'point_of_interest', 'establishment']"
ChIJUQzqw51Zei4REp64Q99zshE,Mamswell Cafe,"Jl. Tunjang No.378, RT.13/RW.41, Pringwulung, Condongcatur, Kabupaten Sleman",4.4,"['cafe', 'store', 'food', 'point_of_interest', 'establishment']"
ChIJV-mvsLVZei4RwvojvG4ws24,Terrace Cafe - The Alana Yogyakarta Hotel,"Jl. Palagan Tentara Pelajar No.Km. 7, Mudal, Sariharjo, Kabupaten Sleman",5,"['cafe', 'food', 'point_of_interest', 'establishment']"
ChIJAQcceplZei4RbesWW4d2RNM,Planet Sport Cafe & Angkringan,"Planet Group Futsal, Jl. Ring Road Utara No.168, Ngringin, Condongcatur, Kabupaten Sleman",3.5,"['cafe', 'food', 'point_of_interest', 'establishment']"
ChIJndd0qNX5ei4RheV4VH6qCAg,DheeHar Kostel & Cafe,"Jl. Sunan Kudus, Gatak, Tamantirto, Kabupaten Bantul",4.2,"['cafe', 'lodging', 'food', 'point_of_interest', 'establishment']"
ChIJPfnXTp9Zei4Ry1jHew1OJC4,JIH Hospital,"Jl. Ring Road Utara No.160, Perumnas Condong Catur, Condongcatur, Kabupaten Sleman",4.7,"['dentist', 'hospital', 'health', 'point_of_interest', 'establishment']"
ChIJR5WZP0xYei4R-x0uq58e-PU,Dr. Sardjito General Hospital,"Jl. Kesehatan Jl. Kesehatan Sendowo No.1, Sendowo, Sinduadi, Kabupaten Sleman",3.7,"['hospital', 'doctor', 'health', 'point_of_interest', 'establishment']"
ChIJj1yWDDVYei4Rr7fvqiSDR9I,Panti Rapih Hospital,"Jl. Cik Di Tiro No.30, Samirono, Terban, Kota Yogyakarta",4.1,"['hospital', 'health', 'point_of_interest', 'establishment']"
ChIJHZKUsYBXei4ROm7cfhqSLDA,Bethesda Hospital Lempuyangwangi,"Jl. Hayam Wuruk No.6, Bausasran, Kota Yogyakarta",4.2,"['hospital', 'health', 'point_of_interest', 'establishment']"
ChIJfWLu1nJXei4RD3gV9HxokbM,Hidayatullah Islamic Hospital,"Jl. Veteran No.184, Pandeyan, Kota Yogyakarta",3.7,"['hospital', 'health', 'point_of_interest', 'establishment']"
ChIJg6vlS55Zei4RiK-5bikPuco,RS Condong Catur,"Jl. Manggis No.6, Gempol, Condongcatur, Kabupaten Sleman",3.9,"['hospital', 'doctor', 'health', 'point_of_interest', 'establishment']"
ChIJxa69-PRXei4RvlyzuqTovl0,Asri Medical Centre (AMC),"Jl. HOS Cokroaminoto No.17B, Pakuncen, Kota Yogyakarta",4.4,"['hospital', 'health', 'point_of_interest', 'establishment']"
ChIJiUfSrh5Yei4RVEin5OOJkMY,Ludira Husada Tama Hospital,"Jl. Wiratama No.4, Tegalrejo, Kota Yogyakarta",3.1,"['hospital', 'health', 'point_of_interest', 'establishment']"
ChIJY8DL6TJYei4RRt58HGQX_Uc,"Bethesda Hospital, Yogyakarta","Jl. Jend. Sudirman No.70, Kotabaru, Kota Yogyakarta",4.1,"['hospital', 'doctor', 'health', 'point_of_interest', 'establishment']"
ChIJg7upyU9Yei4Rk-7EYb4wH2g,RSU Sakina Idaman,"Condro Loekito, Jl. Nyi Tjondrolukito Jl. Blunyah Gede No.60, Kutu Dukuh, Sinduadi, Kabupaten Sleman",4.1,"['hospital', 'doctor', 'health', 'point_of_interest', 'establishment']"
ChIJj7tY__RXei4RxHO7BTZGpHc,Top Asri Clinic Medical Center,"Jl. HOS Cokroaminoto No.17, Pakuncen, Kota Yogyakarta",4.2,"['hospital', 'health', 'point_of_interest', 'establishment']"
ChIJw3s5fEhWei4RylEWMGq2ecc,Hospital Patmasuri,"5995+XWX, Jl. Lapangan Krapyak, Panggungharjo, Sewon, Krapyak Kulon, Panggungharjo, Kabupaten Bantul",3.9,"['hospital', 'health', 'point_of_interest', 'establishment']"
ChIJQ8MIl4dXei4R0nz51wo8wyQ,Pregnancy Hospital Adinda,"Jl. Soragan No.14, Soragan, Ngestiharjo, Kabupaten Bantul",3.7,"['hospital', 'health', 'point_of_interest', 'establishment']"
ChIJV1kNuKdXei4Rth3k78oPmxE,Rumah Sakit Umum Daerah (RSUD) Kota Yogyakarta,"Jl. Ki Ageng Pemanahan No.1-6, Sorosutan, Kota Yogyakarta",3.6,"['hospital', 'doctor', 'health', 'point_of_interest', 'establishment']"
ChIJJ6JVeDRYei4R-agEkOPWW4c,Dr. Yap Eye Hospital,"Jl. Cik Di Tiro No.5, Terban, Kota Yogyakarta",4,"['hospital', 'health', 'point_of_interest', 'establishment']"
ChIJ0fnH_p9Xei4Ru0I4v8fbXJ4,SS Bio Int. PT,"Jl. Menteri Supeno No.60, Sorosutan, Kota Yogyakarta",0,"['hospital', 'health', 'point_of_interest', 'establishment']"
ChIJj8-FOpVXei4R39C9e_soO_g,Rumah Bersalin Agnes,"Jl. Bantul No.24, RW.08, Gedongkiwo, Kota Yogyakarta",0,"['hospital', 'health', 'point_of_interest', 'establishment']"
ChIJG73SH4pXei4RTIRDukxpHlY,Rumah Bersalin Bhayangkara,"JL. Aipda. Karel Satsuit Tubun, No. 20, Ngampilan, Kota Yogyakarta",0,"['hospital', 'health', 'point_of_interest', 'establishment']"
ChIJHQuLkvVXei4RZGAeRz1y_dc,Pandean Jaya. CV,"JL. Turonggo, Blok 3 No. 2, Pakuncen, Kota Yogyakarta",0,"['hospital', 'health', 'point_of_interest', 'establishment']"
ChIJk5FKM4JXei4RxLYcI-Fk8qA,Sudarti Bidan,"Jl. Sultan Agung No.53, Gunungketur, Kota Yogyakarta",0,"['hospital', 'health', 'point_of_interest', 'establishment']"
ChIJpas3bMVXei4RWao4Yk3UPbo,Bidan Woro Iriyani. AM,"58FV+6WF, Padokan Kidul, Tirtonirmolo, Kasihan, Padokan Lor, Tirtonirmolo, Kabupaten Bantul",0,"['hospital', 'health', 'point_of_interest', 'establishment']"
ChIJJXEQGZVZei4Rq6OcHvHoicA,Kaki Kita Reflexology,"JL. Perumnas no 1, No. 1, Catur Tunggal, Dabag, Condongcatur, Kabupaten Sleman",3,"['hospital', 'health', 'point_of_interest', 'establishment']"
ChIJ_ZJl4pFZei4RFUtGqW3IlEg,First Medical,"Jl. Urip Sumoharjo No.103A, Klitren, Kota Yogyakarta",5,"['health', 'point_of_interest', 'establishment']"
ChIJ4QNX8ZRZei4R5Meph_v9mbQ,JOGJA MEDICAL CENTER (JMC),"Jl. Pandean Sari No.4, RW.2, Kentungan, Condongcatur, Kabupaten Sleman",4.7,"['hospital', 'health', 'point_of_interest', 'establishment']"
ChIJm2R5fWdXei4RD4zO6JbdZhM,Setia Budi Medical Centre,"Jl. Raya Janti Jl. Gedongkuning No.16, Wonocatur, Banguntapan, Kabupaten Bantul",2.8,"['health', 'point_of_interest', 'establishment']"
ChIJw1OiGMtZei4R7n0PQec4fEs,Med Point,"Jl. Prof. Herman Yohanes No.107, Samirono, Caturtunggal, Kabupaten Sleman",0,"['hospital', 'health', 'point_of_interest', 'establishment']"
ChIJuVxLJbtZei4RM7sag1eH7Zo,Apotek dan Klinik Tirta Medical Centre Yogyakarta,"Magelang St No.71, Kricak, Yogyakarta City",4.5,"['health', 'point_of_interest', 'establishment']"
ChIJ_YxuC0X5ei4RP5krbiUKHbI,K4 Medical Project,"58QJ+F6V, Brajan, Tamantirto, yogyakarta",0,"['health', 'point_of_interest', 'establishment']"
ChIJe_d_UUpYei4R_3_PdKhlMRM,Gadjah Mada Medical Center,"L 3 Sekip, Jl. Kayu Putih, Sendowo, Sinduadi, Kabupaten Sleman",3.8,"['health', 'point_of_interest', 'establishment']"
ChIJm76ZTzRZei4RFx35nvzjZq4,YoyiC Outlet Kucala Medical Center,"001, Jl. Jend. Sudirman No.58, Kotabaru, Yogyakarta City",0,"['health', 'point_of_interest', 'establishment']"
ChIJZxEH_TNYei4RlFJV3m62nkk,indomedis.com,"Hotel Orlen Jl. C. Simanjuntak #6A, Terban, Kota Yogyakarta",2,"['hospital', 'health', 'point_of_interest', 'establishment']"
ChIJ39SFvfVXei4Rwk5HvhZTbbM,Klinik Meira (Meira Medical Center),"Jl. Bantul No.93, Dongkelan, Panggungharjo, Kabupaten Bantul",4.7,"['doctor', 'dentist', 'pharmacy', 'health', 'point_of_interest', 'store', 'establishment']"
ChIJlWfzus1Zei4RcKS9XUwZnF0,indomedis.com,"Jl. Selokan Mataram Jl. Babarsari No.#33, Kledokan, Caturtunggal, Kabupaten Sleman",4,"['hospital', 'health', 'point_of_interest', 'establishment']"
ChIJ-eqLJXtXei4RBlx_i3ybcxE,Klinik UST Medical Center,"Jl. Kusumanegara No.157, Warungboto, Kota Yogyakarta",0,"['hospital', 'health', 'point_of_interest', 'establishment']"
ChIJtzQiJWf3ei4RRtYHyVMqcLM,Sae Medikalindo,"Cokrobedog No.134, RT.08/RW.12, Kramat, Sidoarum, Kabupaten Sleman",0,"['health', 'point_of_interest', 'establishment']"
ChIJ0eoWMQtXei4R4o_wQKOQY5Q,Klinik Utama Ultra Medica Yogyakarta,"Jl. Tegalturi No.53, Giwangan, Kota Yogyakarta",4.1,"['health', 'point_of_interest', 'establishment']"
ChIJbddlKyhYei4RWm2t_iB6yxQ,SENTRA MEDICAL SPA,"Perum Pindok Intan Permai 3 Blok B8-b9, Kricak, Tegalrejo, Kricak, Kota Yogyakarta",0,"['health', 'point_of_interest', 'establishment']"
ChIJtcbmVOlXei4RCJQSa-IGpG8,Convention Hall Asri Medical Centre Yogyakarta,"Asri medical centre, Pakuncen, Yogyakarta City",0,"['hospital', 'health', 'point_of_interest', 'establishment']"
ChIJXZTGOitYei4RFEOd_reyijc,CV. Gama Medical,"Jl. Doktor Sutomo No.57, Bausasran, Kota Yogyakarta",0,"['pharmacy', 'health', 'point_of_interest', 'store', 'establishment']"
ChIJj7tY__RXei4RxHO7BTZGpHc,Top Asri Clinic Medical Center,"Jl. HOS Cokroaminoto No.17, Pakuncen, Kota Yogyakarta",4.2,"['hospital', 'health', 'point_of_interest', 'establishment']"
ChIJIy4rBpVZei4RIPPeZOT_i2c,NUBIA MEDICAL AESTHETIC,"RUKO PANDA, Jl. Ring Road Utara No.9, Sanggrahan, Condongcatur, Sleman Regency",5,"['doctor', 'health', 'point_of_interest', 'establishment']"
ChIJlUQnuNtZei4Ryj7s1nVK38A,C2S Medical Tools,"696V+QM3, Jl. Timoho, Demangan, Kota Yogyakarta",0,"['health', 'point_of_interest', 'store', 'establishment']"
ChIJtf9S45hZei4RWavevdwUdPo,Barokah Medical Jogja,"Jl. Ring Road Utara Gorongan No.282, Ngropoh, Condongcatur, Kabupaten Sleman",4.4,"['health', 'point_of_interest', 'store', 'establishment']"
ChIJV2y7q0xXei4ROQoPF4uG2PI,Jual Alat kesehatan Lengkap jogja,"Jl. Kapten Piere Tendean No.56, Wirobrajan, Kota Yogyakarta",0,"['health', 'point_of_interest', 'establishment']"
ChIJD5Ij__lXei4R29NzV5JVshE,Nugroho Medical | Toko Alat Kesehatan Jogja,"Jl. Kaliurang Gg. Pandega Mandala No.3 Km 5,6, Manggung, Caturtunggal, Kabupaten Sleman",4.9,"['health', 'point_of_interest', 'store', 'establishment']"
ChIJxa69-PRXei4RvlyzuqTovl0,Asri Medical Centre (AMC),"Jl. HOS Cokroaminoto No.17B, Pakuncen, Kota Yogyakarta",4.4,"['hospital', 'health', 'point_of_interest', 'establishment']"
ChIJ9z8ILJJZei4RxhJWDB5Bk_Q,Klinik drA (Raisha Vaksin Corner Seturan) d.h dokter.anti,"Jl. Lawu 4 No.11, RT.19/RW.02, Kledokan, Caturtunggal, Yogyakarta",4.9,"['doctor', 'health', 'point_of_interest', 'establishment']"
