Place ID,Name,Address,Rating,Types
ChIJEVZa__RXei4RbtcjELuxi_Q,Klinik Perawatan Luka,"Klinik Utama Asri Medical Centre, Jl. HOS Cokroaminoto No.17, Pakuncen, Kota Yogyakarta",1,"['health', 'point_of_interest', 'establishment']"
ChIJ1cjttdJZei4RMTzUaQd0kwM,ABMED STORE YOGYAKARTA | Toko Alat Kesehatan Yogyakarta,"Jl. Poncowinatan No.84 A, Cokrodiningratan, Kota Yogyakarta",4.2,"['health', 'point_of_interest', 'store', 'establishment']"
ChIJrWE_c7r3ei4RPOUpaRFZ5wQ,Brimedika Clinic Yogyakarta,"Jl. Brigjen Katamso No.21, Keparakan, Kota Yogyakarta",3.9,"['health', 'point_of_interest', 'establishment']"
ChIJW4orjmdXei4R7ZoQc8m8KQg,KLINIK RAMADHAN,"Jl. Kusumanegara No.296, Rejowinangun, Kota Yogyakarta",3,"['health', 'point_of_interest', 'establishment']"
ChIJaddNSNhZei4Rusn-Yx7E-Wc,Happy Land Medical Centre,"Jl. Ipda Tut Harsono Jl. Melati Wetan No.53, Muja Muju, Kota Yogyakarta",3.9,"['hospital', 'health', 'point_of_interest', 'establishment']"
ChIJLY_8__RXei4R05R8BItiwEk,Poly Dental Education - Asri Clinic Medical Center,"Klinik Utama Asri Media Center, Jl. HOS Cokroaminoto No.17, Pakuncen, Kota Yogyakarta",3.4,"['health', 'point_of_interest', 'establishment']"
ChIJR9BR5dJXei4RU-7EG624ois,Klinik Arda,"Jl. Tegalturi No.44, Giwangan, Kota Yogyakarta",4.9,"['hospital', 'doctor', 'dentist', 'health', 'point_of_interest', 'establishment']"
ChIJVx-mwixYei4RM3uvcxN3ddU,Laboratorium Klinik Cito Yogyakarta,"Jl. Atmosukarto No.4, Kotabaru, Kota Yogyakarta",4.5,"['health', 'point_of_interest', 'establishment']"
ChIJ14Eq2jxZei4RfUJ08jqIJCs,Praktek dr. Harti,"Jl. Pogung Lor No.212, RT.02/RW.46, Pogung Lor, Sinduadi, Kabupaten Sleman",5,"['health', 'point_of_interest', 'establishment']"
ChIJQXu-Ynb4ei4Rzx-jP1IwzTA,KLINIK ANUGERAH,"Jl. Rindang No.145, Jadan, Tamantirto, Kabupaten Bantul",4.4,"['health', 'point_of_interest', 'establishment']"
ChIJ1xDbWIFXei4RfEwpvOhnOT8,Klinik Intan,"Jl. Masjid No.3, Gunungketur, Kota Yogyakarta",4.7,"['health', 'point_of_interest', 'establishment']"
ChIJK5ZETbJZei4R7c6LeJ68bTk,Korpagama UGM Clinic,"Jl. Agro No.38C, Kocoran, Caturtunggal, Kabupaten Sleman",4.3,"['health', 'point_of_interest', 'establishment']"
ChIJBatEaKdZei4RNh970aE7yhE,Alat pijat amplas amplas ambarrukmo,"Plaza Ambarrukmo, Ambarukmo, Caturtunggal, Kabupaten Sleman",0,"['health', 'point_of_interest', 'establishment']"
ChIJOWJcR7xXei4RJt4Xqn_Sztw,Klinik Gading,"Jl. DI Panjaitan No.25, Mantrijeron, Kota Yogyakarta",4.6,"['doctor', 'dentist', 'health', 'point_of_interest', 'establishment']"
ChIJDa6cQZpZei4RgpeD-Qn41pA,Klinik Pratama Yonmek 403,"Jl. Pandega Sakti No.11, RW.2, Kentungan, Condongcatur, Kabupaten Sleman",4.9,"['health', 'point_of_interest', 'establishment']"
ChIJwcoWQllXei4RwQc2z6NH9JI,Belva Medika,"Jl. Raya Janti No.297, Modalan, Banguntapan, Kabupaten Bantul",4.9,"['health', 'store', 'point_of_interest', 'establishment']"
ChIJsVG7y6RZei4RGIKanc0eDow,Pelayanan Kesehatan Masyarakat Gki Gejayan Dr Istianto K.,"69PV+HVV, Gg. Jemb. Merah, Soropadan, Condongcatur, Kabupaten Sleman",5,"['health', 'point_of_interest', 'establishment']"
ChIJJVNel6xZei4RXoa8dT2uLw0,"Intibios Lab, Klinik & Farmasi Yogyakarta","Jl. Pangeran Diponegoro No.92, Cokrodiningratan, Kota Yogyakarta",5,"['hospital', 'pharmacy', 'health', 'store', 'point_of_interest', 'establishment']"
ChIJGUnsUQr4ei4RnCB7MaSxN3E,Kangen Water Center WA 0813 3250 4500,"Dsn. Kasihan, RT.1.39G, Tamantirto, Kabupaten Bantul",4.9,"['health', 'point_of_interest', 'establishment']"
ChIJ_RfESx1Zei4Ry8L_iSKbA04,KLINIK PRATAMA DELIMA,"jln swadaya 1 karangasem gempol, RT.04/RW.12, Condongcatur",4.7,"['health', 'point_of_interest', 'establishment']"
ChIJN-3tbSlXei4RfBWnEJaB5iM,Site Studio 4,"59G9+WR5, Brontokusuman, Yogyakarta City",0,"['health', 'point_of_interest', 'establishment']"
ChIJ_ZwvSIlXei4RFJdsdXubTkQ,Ruang Ct- Scan,"Ngupasan, Yogyakarta City",0,"['health', 'point_of_interest', 'establishment']"
ChIJL6YgfEJXei4RVLQiUy-WmFU,Poskokesdes Desa Siaga,"Gg. Umbuh No.170, Pringgolayan, Banguntapan, Kabupaten Bantul",0,"['health', 'point_of_interest', 'establishment']"
ChIJD4K26-SRUGERaDyA-x9k6X8,Fisioterapi cryopraktik homecare seturan,"Dekat CV. Kurai, Jl. Jatayu No.236a, Pringwulung, Condongcatur, Kabupaten Sleman",0,"['health', 'point_of_interest', 'establishment']"
ChIJl2wXgcj5ei4R-5A3JCTqqaI,KLINIK PRATAMA PMI DIY,"Jl.Ring Road Barat No.03 RT. 09 RW. 15, Patuk, Area Sawah, Banyuraden, Kabupaten Sleman",3.8,"['health', 'point_of_interest', 'establishment']"
ChIJIYiNlgxYei4RgOLIYLaOPS4,Laboratorium Klinik Dutarama,"68FH+6V3, Jl. Ngapak - Kentheng, Nogosaren, Nogotirto, Kabupaten Sleman",5,"['health', 'point_of_interest', 'establishment']"
ChIJiUEPxc1Zei4RZQ2RaiiQwD0,Klinik Medico Dental Center,"Jl. Urip Sumoharjo No.103 F, Klitren, Kota Yogyakarta",3.9,"['health', 'point_of_interest', 'establishment']"
ChIJIT_8__RXei4RI1LBfUsR8U0,Poli Ob SGYN,"Top Asri Clinic Medical Center, Jl. HOS Cokroaminoto No.17, Pakuncen, Yogyakarta City",0,"['health', 'point_of_interest', 'establishment']"
ChIJO8Ep_5ZXei4RSyhYjiqo0MA,"KLINIK, LABORATORIUM, APOTEK dan ALAT KESEHATAN ASTA MEDIKA","Jl. Mayjend Sutoyo No.7, Mantrijeron, Kota Yogyakarta",4.7,"['pharmacy', 'health', 'store', 'point_of_interest', 'establishment']"
ChIJQRku_vRXei4R28qdmfoE8fs,Laboratorium Reproduksi Dan Diagnostik,"6922+7Q4, Jl. HOS Cokroaminoto, Pakuncen, Kota Yogyakarta",0,"['health', 'point_of_interest', 'establishment']"
ChIJZwuy2kJZei4R6-pXic9WLrM,Pijat Panggilan Jogja Kota dan Sekitarnya,"Klitren, Yogyakarta City",0,"['health', 'point_of_interest', 'establishment']"
ChIJi0naR7xZei4RZUMBqikEC1Y,Bidan Octa Gamping Yogyakarta,"Jl. Nogotirto, RT.07/RW.21, Modinan, Banyuraden, Kabupaten Sleman",5,"['health', 'point_of_interest', 'establishment']"
ChIJnxGZ-3RYei4RWgqsdujCtyE,Pos Kesehatan Desa Poskedes,"68GM+2PP, Jl. Nogosaren Baru, Nogosaren, Nogotirto, Kabupaten Sleman",0,"['health', 'point_of_interest', 'establishment']"
ChIJxTql-C9Yei4RU7k3FQ1eGzs,Laboratorium Klinik Prodia,"Jl. P. Mangkubumi No.50, Gowongan, Kota Yogyakarta",4.1,"['health', 'point_of_interest', 'establishment']"
ChIJ519GsGNXei4RvI1Stsi8Mao,Elisa Family Healthcare Yogyakarta,"Jl. Balirejo Jl. Timoho No.6a, Muja Muju, Kota Yogyakarta",4.9,"['doctor', 'local_government_office', 'health', 'point_of_interest', 'establishment']"
